สถานที่,8d84ba9f-52c6-44f4-9d96-b25948bd8013:a8d5b0b0-fad1-4cf9-88b5-a8cc2c324086:e947f2d0-7947-4701-bbb7-0a2a03b592b2:ac1f8a12-7525-4d73-adb2-0cd5bed10aa7:5d393e02-ca64-46e4-ba55-c0c7843f21c4:2767c0fb-edbc-45ca-b9b8-62fae2166c10,สถานที่ชำรุด:ทางเดินชำรุด
อาหาร,41e91003-aed2-4d8f-8da3-f15bb2bba5a6:7aa3fc35-6460-4c28-bb15-0f1e0bb4658d:3a4d9aa4-bcef-423c-819c-fec190b8f6fe,อาหารไม่ถูกหลักอนามัย
บุคลากร,63f8150a-32d8-4dc2-ac05-80dfd288a1e4:f4007556-f0b1-4f7f-a7bd-86039b6d3ebb:6767d2f2-7bf9-4eee-8fc5-4e82ad7f063a,การบริการ:การบริหาร
ความสะอาด,,สถานที่ไม่สะอาด
รักษาความสงบ,f7956351-621f-4d0f-bfde-2bbaa0342b2a:8ca5f4cb-08c5-46ae-bc2d-ed7516cf85e6:ed226f4c-ac33-42da-a4ac-3adf104d6176,กิจกรรมไม่พึงประสงค์:ทะเลาะวิวาท:ก่อความวุ่นวาย
ปราบปรามยาเสพติด,245e7f16-ad56-43c3-86f8-27180d10a794:68f4c46d-cf1c-48af-8cae-81070ab68da2:d2a4e5cb-c70d-44a1-bc0f-44e64e4c8e4b,สารเสพติด
